Agency,Country,Activity Name,Start Year,End Year,Implementer,Description,Link to Website,Pre-Primary,Primary,Secondary,Workforce Development,Education Systems Strengthening
DOS,Rwanda,OVC,Ongoing,Ongoing,PEPFAR,"This activity aims to improve educational access and learning for children and adolescents affected by HIV/AIDS across 24 countries with a focus on ensuring their access to a safe learning environment to complete their primary education, strengthening community-school relationships, and supporting transition to secondary school particularly for adolescent girls.",https://www.state.gov/populations/children/,X,X,X,,
DOS,South Africa,OVC,Ongoing,Ongoing,PEPFAR,"This activity aims to improve educational access and learning for children and adolescents affected by HIV/AIDS across 24 countries with a focus on ensuring their access to a safe learning environment to complete their primary education, strengthening community-school relationships, and supporting transition to secondary school particularly for adolescent girls.",https://www.state.gov/populations/children/,X,X,X,,
DOS,South Sudan,OVC,Ongoing,Ongoing,PEPFAR,"This activity aims to improve educational access and learning for children and adolescents affected by HIV/AIDS across 24 countries with a focus on ensuring their access to a safe learning environment to complete their primary education, strengthening community-school relationships, and supporting transition to secondary school particularly for adolescent girls.",https://www.state.gov/populations/children/,X,X,X,,
DOS,Tanzania,OVC,Ongoing,Ongoing,PEPFAR,"This activity aims to improve educational access and learning for children and adolescents affected by HIV/AIDS across 24 countries with a focus on ensuring their access to a safe learning environment to complete their primary education, strengthening community-school relationships, and supporting transition to secondary school particularly for adolescent girls.",https://www.state.gov/populations/children/,X,X,X,,
DOS,Uganda,OVC,Ongoing,Ongoing,PEPFAR,"This activity aims to improve educational access and learning for children and adolescents affected by HIV/AIDS across 24 countries with a focus on ensuring their access to a safe learning environment to complete their primary education, strengthening community-school relationships, and supporting transition to secondary school particularly for adolescent girls.",https://www.state.gov/populations/children/,X,X,X,,
DOS,Ukraine,OVC,Ongoing,Ongoing,PEPFAR,"This activity aims to improve educational access and learning for children and adolescents affected by HIV/AIDS across 24 countries with a focus on ensuring their access to a safe learning environment to complete their primary education, strengthening community-school relationships, and supporting transition to secondary school particularly for adolescent girls.",https://www.state.gov/populations/children/,X,X,X,,
DOS,Zambia,OVC,Ongoing,Ongoing,PEPFAR,"This activity aims to improve educational access and learning for children and adolescents affected by HIV/AIDS across 24 countries with a focus on ensuring their access to a safe learning environment to complete their primary education, strengthening community-school relationships, and supporting transition to secondary school particularly for adolescent girls.",https://www.state.gov/populations/children/,X,X,X,,
DOS,Zimbabwe,OVC,Ongoing,Ongoing,PEPFAR,"This activity aims to improve educational access and learning for children and adolescents affected by HIV/AIDS across 24 countries with a focus on ensuring their access to a safe learning environment to complete their primary education, strengthening community-school relationships, and supporting transition to secondary school particularly for adolescent girls.",https://www.state.gov/populations/children/,X,X,X,,
USAID,Niger,Youth Connect (BYC),2020,2025,Mercy Corps,"The activity will focus on equipping youth with the skills they need to work and earn a living; improving access to economic opportunities, networks, market information, and finance for young people and youth groups; and encouraging the active participation by young people and youth groups in the decision-making process in their communities.",https://www.swisscontact.org/en/projects/bridge-youth-connect,,,,X,
USAID,Malawi,Secondary Education Expansion and Development (SEED) Contract Management Consultant (CMC),2019,2022,Tetra Tech Engineering,The activity provides engineering oversight services for all construction work under SEED phases 1 and 2.,https://www.tetratech.com/en/projects/design-and-construction-oversight-for-secondary-school-expansion-malawi,-,,X,,
USAID,Nepal,"Local Systems Strengthening to Reduce Child, Early, and Forced Marriage (CEFM)",2019,2022,The John Hopkins University,"This activity aims to strengthen the institutional and technical capacity of the Government of Nepal in Province 2 to reduce CEFM by designing, implementing, monitoring, evaluating, and coordinating effective social and behavior change activities and child protection system strengthening for reducing CEFM through a community-based, multi-sectoral, data-driven lens. During COVID-19, a new objective was added to increase learning outcomes for girls through informal education.",https://www.thecompassforsbc.org/project-examples/nepal-program-reduce-child-early-and-forced-marriage-r-cefm,-,X,,,X
USAID,Eastern and Southern Carribbean,Capacity Strengthening for Digital Education in the Eastern and Southern Caribbean,2022,2023,UNICEF,"This activity is aimed at strengthening the capacity of Dominica, Grenada, Saint Kitts and Nevis, Saint Lucia and Saint Vincent and the Grenadines to deliver quality online education. A key objective of the USAID-UNICEF intervention is aimed at strengthening the capacity of the Organization of Eastern Caribbean States (OECS) to deliver online pedagogy. This will include building the capacity of teachers to deliver and monitor online learning, ensuring that content is accessible to all.",https://www.unicef.org/easterncaribbean/stories/usaid-unicef-sign-agreement-boost-digital-education-eastern-caribbean,,X,X,,X
USAID,Nigeria ,Partnership with USAID to Address Post Conflict Activities To Counter Violent Extremism in Borno State (UNIMAID),2019,2022,University of Maiduguri ,"This activity addresses the post-conflict educational needs of Internally Displaced Persons (IDP) children through conflict reduction-based programming, Social and Emotional Learning and conflict-sensitive curriculum, common language instruction, and introducing a Diploma in Countering Violent Extremism (CVE).",https://www.unimaid.edu.ng/News,-,X,,,X
USAID,Guatemala,Basic Education Quality and Transitions for Lower Secondary (BEQT),2022,2027,RTI,"This activity will partner with the Ministry of Education to improve education quality and advancement through key transitions of primary and lower secondary education. It will improve foundational reading, writing, math, and social and emotional skills acquisition for children and youth through the formal education system and will increase the transition rate of students from primary to lower secondary education in targeted rural municipalities of Guatemala",https://www.usaid.gov/business-forecast/search/award/85b514f320?search=&location=All&ouid=All&page=1,-,X,X,,X
USAID,Kyrgyzstan,Safe Migration in Central Asia,2019,2024,Winrock International,"This activity aims at strengthening the mutual accountability and effectiveness of the government, civil society, and the private sector to prevent trafficking in persons, protect survivors, and promote safe migration in Tajikistan and other Central Asian countries, including Kazakhstan, Kyrgyzstan, Turkmenistan and Uzbekistan.",https://www.usaid.gov/central-asia-regional/fact-sheets/safe-migration-central-asia,-,,,,X
USAID,Uzbekistan,Safe Migration in Central Asia,2019,2024,Winrock International,"This activity aims at strengthening the mutual accountability and effectiveness of the government, civil society, and the private sector to prevent trafficking in persons, protect survivors, and promote safe migration in Tajikistan and other Central Asian countries, including Kazakhstan, Kyrgyzstan, Turkmenistan and Uzbekistan.","https://www.usaid.gov/central-asia-regional/fact-sheets/safe-migration-central-asia#:~:text=The%20Safe%20Migration%20in%20Central,part%20of%20USAID's%20Asia%2Dwide",-,,,,X
USAID,Colombia,Pacific in Progress Activity,2020,2023,Manos Visibles/ Pacific Power Fund,"The Avanza Pacifico Activity provides scholarships, education support, leadership training, and capacity building to Afro-Colombian and Indigenous individuals and organizations in Colombia’s Pacific Coast region. Avanza Pacifico is implemented by the Colombian organization Manos Visibles (“Visible Hands”) in Cauca, Choco, Nariño, and Valle del Cauca, and in the cities of Bogota, Medellin and Cartagena. It's one of our first direct awards to Afro-Colombia and Indigenous organizations under an APS we launched in 2018.",https://www.usaid.gov/colombia/fact-sheets/pgo-avanza-pac%C3%ADfico,,,X,,X
USAID,Colombia,Youth Resilience Activity,2020,2025,ACDI-VOCA,"Through this activity, USAID/Colombia’s Reconciliation and Inclusion Office (RIO) seeks to support youth in high risk environments to reach their full potential, as safe, productive, healthy and engaged participants with positive enabling environments where violence is prevented and risks associated with crime are mitigated. This will entail supporting youth-centered efforts targeting Colombian and Venezuelan youth, disengaged child soldiers, and former youth offenders. Adhering to USAID’s Youth in Development Policy definition of young people, YRA’s target youth range is from ages 10 to 29, with emphasis on adolescence and emerging adulthood (ages 15-29). From a socio-ecological systems approach, YRA also targets youth’s families, community, service providers, and others impacting their development.",https://www.usaid.gov/colombia/fact-sheets/pgo-youth-resilience,,,X,X,X
USAID,Colombia,Together We Learn Activity,2021,2026,Partners of the Americas,"Juntos Aprendemos works to: improve the quality of education for children and youth in receptor communities at the pre-school, primary, and secondary education levels; increase access to quality education for children and youth in receptor communities; and strengthen community engagement in educational opportunities, with a focus on school clusters most affected by the influx of migrants. ",https://www.usaid.gov/colombia/fact-sheets/vrio-juntos-aprendemos,X,X,X,,X
USAID,El Salvador,Protection and Quality of Care for Children,2018,2023,Whole Child International,This activity will increase the capacity of the government of El Salvador to protect and care for children most at risk of being victims or perpetrators of violence.,https://www.usaid.gov/documents/1862/protection-and-quality-care-children,X,,,,X
USAID,Afghanistan,Girls Education Challenge - USAID & UK DFID,2016,2023,Agha Khan Foundation,"This activity provides girls with access to education, materials, and safe spaces to learn.",https://www.usaid.gov/documents/1871/girls%E2%80%99-education-challenge-gec, ,X,X,X,X
USAID,Zambia,Zambia Edufinance activity,2020,2025,"Palladium, Opportunity International, Education Partnership Group and
PEAS","This activity leverages essential private capital to improve access to quality, primary education for students in target catchment zones. The project ultimately contributes much-needed enrollment opportunities for primary school students in Zambia",https://www.usaid.gov/documents/edufinance-fact-sheet,,X,,,
USAID,Zambia,Transforming Teacher Education activity,2020,2025,Florida State University (FSU),"This activity strengthens the capacity of Zambia’s Colleges of Education (COE) and universities to equip teachers with the tools they need to deliver high-quality instruction in reading and local language literacy.The activity will ultimately ensure teachers are better prepared to help their students thrive in the classroom.",https://www.usaid.gov/documents/transforming-teacher-education,,,,,
USAID,Dominican Republic,READ Program,2015,2022,Unibe,"The activity improves students’ reading skills and strengthens instruction through enhanced curriculum and innovative approaches to education, while ensuring schools are safe and inclusive for all students.",https://www.usaid.gov/dominican-republic/news/improving-reading-skills,,X,X,,
USAID,Egypt,Early Grade Learning and Remedial Reading Activity (G2G),2017,2022,Ministry of Education,"This activity aims to ensure students learn the fundamental of reading comprehension, writing, mathematics, and English language by the end of primary school (grade 3). It will also provide remedial learning for students in grades 4-9. Activities include conducting teacher professional development activities, developing digital and traditional teaching materials, and supporting policy assessment and reform.",https://www.usaid.gov/egypt/basic-education/early-grade-learning,,X,,,X
USAID,Egypt,Early Grade Learning and Remedial Reading Activity (G2G),2017,2023,Ministry of Education,"This activity aims to ensure students learn the fundamental of reading comprehension, writing, mathematics, and English language by the end of primary school (grade 3). It will also provide remedial learning for students in grades 4-9. Activities include conducting teacher professional development activities, developing digital and traditional teaching materials, and supporting policy assessment and reform.",https://www.usaid.gov/egypt/basic-education/early-grade-learning,,X,,,X
USAID,Egypt,The Literate Village,2017,2023,Save the Children,"This activity aims to eradicate illiteracy among mothers and primary school-aged children in 1,447 villages that are poor with low literacy rates. The activity targets mothers of primary school children through Adult Literacy Classes and works with remedial reading children through community schools to boost their literacy.",https://www.usaid.gov/egypt/basic-education/literate-village,-,X,,,
USAID,Egypt,The Literate Village,2017,2023,Save the Children,"This activity aims to eradicate illiteracy among mothers and primary school-aged children in 1,447 villages that are poor with low literacy rates. The activity targets mothers of primary school children through Adult Literacy Classes and works with remedial reading children through community schools to boost their literacy.",https://www.usaid.gov/egypt/basic-education/literate-village,-,X,,,
USAID,Egypt,STEM Teacher Education and School Strengthening Activity (STESSA),2018,2023,21st Century Partnership for STEM Education (21PSTEM),"This activity supports STEM education. It will implement STEM teacher education to support Faculties of Education to develop and deliver high-quality STEM teacher education and preparation programs at undergraduate and graduate levels. Additionally, it will support school strengthening to increase MOE staff capacity and institutionalize roles and processes to maintain high quality STEM schools.",https://www.usaid.gov/egypt/basic-education/support-stem-secondary-education,,,X,,X
USAID,Egypt,Teach for Tomorrow,2020,2024,Education Development Center (EDC),"This activity focuses on system strengthening and aims to establish an effective in-service training and professional development system for teachers, mentors/coaches, supervisors, and school leaders and to institutionalize an effective system for the licensing and certification of teachers, supervisors, and school leaders.",https://www.usaid.gov/egypt/basic-education/teach-tomorrow,,X,,,X
USAID,Guatemala,Puentes,2017,2022,World Vision,"This activity aims to improve the quality of life for youth aged 15-24 from the Western Highlands of Guatemala as measured by employment, education, development assets, and hopefulness indicators, thereby addressing the major drivers of undocumented external migration.",https://www.usaid.gov/guatemala/programs/puentes,-,,X,X,X
USAID,Jordan,Inclusive Schools Program,2021,2026,Ministry of Education; Ministry of Public Works and Housing; Bitar Consultants,"USAID’s Inclusive Schools Program will support the construction and furnishing of 30 Ministry of Education schools throughout Jordan. The Program seeks to increase access to high quality, inclusive education for all students. ",https://www.usaid.gov/jordan/fact-sheets/inclusive-schools-program,,x,x,,
USAID,Jordan,Jordan Education Infrastructure Project,2014,2026,"Ministry of Public Works and Housing and Ministry of Education, UNOPS, Trigon, Bitar Consultants, Engicon, Kaizen: A Tetra Tech Company, local design and construction firms","In partnership with both the Ministry of Public Works & Housing and the Ministry of Education, USAID Jordan’s Education Infrastructure project builds, furnishes, and expands schools, and improves school infrastructure. These services include assessments, feasibility studies, designs, capacity building, operations and maintenance, customer service, and financial support.  ",https://www.usaid.gov/jordan/fact-sheets/jordan-education-infrastructure,,,,,
USAID,Jordan,Partnership for Education II,2020,2023,Ministry of Education,"The Partnership for Education II focuses on improving teaching and learning materials; building the capacity of teachers in the core subjects of Arabic literacy, mathematics, English, and science; improving access to data and assessments; and strengthening the capacity of Ministry staff to effectively execute national priorities.",https://www.usaid.gov/jordan/fact-sheets/partnership-for-education-ii,,x,,,
USAID,Jordan,Schools for a Knowledge Economy,2014,2022,"Ministry of Public Works and Housing, Ministry of Education, Engicon Consultants, Trigon, and local engineering and construction firms","USAID’s Schools for a Knowledge Economy (SKEP) Project is building and furnishing 25 new schools throughout Jordan, increasing students’ access to inclusive, environmentally-friendly, and student-centered learning environments. ",https://www.usaid.gov/jordan/fact-sheets/schools-for-knowledge-economy,,,,,
USAID,Jordan,Technical Assistance Program,2021,2026,"Ministry of Education; Ministry of Youth; Creative Associates International, Inc.","To ensure that government partners have the necessary skills and resources to effect change in the education and youth sectors, the Technical Assistance Program transforms the organizational culture and increases the institutional capacity within the Ministry of Education and the Ministry of Youth.",https://www.usaid.gov/jordan/fact-sheets/technical-assistance-program,,,,,
USAID,Jordan,Partnership for Youth ,2020,2022,Ministry of Youth ,This activity supports the activation of 6 youth centers and establishing a virtual youth center.,https://www.usaid.gov/jordan/youth,-,,,X,X
USAID,Kyrgyz Republic,Enhancing Employability and Civic Engagement of Youth in the Kyrgyz Republic,2016,2022,Public Foundation Kyrgyzstan Mountain Societies Development Support Program (MSDSP),"This activity will support youth to more actively and positively participate in civic, social and economic life and contribute to the development of their families and communities. This will be achieved by developing youth skills, supporting youth (self-)employment initiatives, identifying private sector opportunities, and working with the local government.",https://www.usaid.gov/kyrgyz-republic/fact-sheets/enhancing-employability-and-civic-engagement-youth,-,,X,X,
USAID,Kyrgyz Republic,IBE-KR (Okuu Keremet),2019,2024,RTI International,"This activity aims to improve the foundational learning outcomes in reading and math among primary grade students in 75% of primary schools nationwide. The goal will be achieved through work in improving instructional quality in reading, numeracy and math; improving formal and non-formal learning environments; and strengthening the education system for primary education. ",https://www.usaid.gov/kyrgyz-republic/fact-sheets/okuu-keremet-learning-awesome,-,X,,,X
USAID,Liberia,Read Liberia,2017,2022,RTI International,"This activity supports school-based early grade reading for kindergarten and grades 1-2, provides targeted capacity development for teachers, principals, and administrators, distributes textbooks and learning materials, and promotes reading policy development and messaging to foster a reading culture.",https://www.usaid.gov/liberia/fact-sheets/read-liberia-activity,X,X,,,X
USAID,Liberia,Read Liberia,2017,2022,RTI International,"This activity supports school-based early grade reading for kindergarten and grades 1-2, provides targeted capacity development for teachers, principals, and administrators, distributes textbooks and learning materials, and promotes reading policy development and messaging to foster a reading culture.",https://www.usaid.gov/liberia/fact-sheets/read-liberia-activity,X,X,,,X
USAID,Liberia,School Feeding Program II ,2019,2022,Mary's Meals ,"This activity provides school feeding to pre-primary, primary, and secondary school students.",https://www.usaid.gov/liberia/fact-sheets/school-feeding-program-ii,X,X,X,,
USAID,Morocco,Inclusive Education Teacher Training activity,2022,2025,"DevTech Systems, Inc./University of Tennessee-Knoxville, Center on Deafness","This activity will deliver MSL courses to primary school teachers, prepare an in-service training program on deaf education for current primary school-level teachers, collaborate on a deaf education certificate program for future teachers, and build the capacity of the deaf community to promote deaf education and awareness.",https://www.usaid.gov/morocco/fact-sheets/inclusive-education-teacher-training-activity,,,,,
USAID,Mozambique,Community Engagement for Bilingual Education (Zambezia),2020,2023,Civil Society Capacity Building Centre (CESC),"This activity aims to strengthen civil society engagement in early grade reading and improve the quality of reading instruction for primary school-aged children to increase
the long-term sustainability of EGR activities. ",https://www.usaid.gov/mozambique/documents/community-engagement-bilingual-education,,X,,,
USAID,Mozambique,Resilient Gorongosa,2020,2025,"GORONGOSA PROJECT, INC.","This activity will support improved access to and participation in education services, increased literacy and numeracy skills among girls and young women, positive youth development for girls, and the establishment of Youth and Teacher Clubs in 50 schools.",https://www.usaid.gov/mozambique/documents/resilient-gorongosa,-,X,X,X,
USAID,Mozambique,Apoiar a Ler,2020,2023,ADPP,This activity will to encourage parents and caregivers to take on a more meaningful role in their children’s schooling while also mobilizing civil society and key local stakeholders to engage with the school system. It focuses on improving the quality of education in 750 targeted schools across Nampula. ,https://www.usaid.gov/mozambique/documents/usaid-apoiar-ler,,X,,,
USAID,Nepal,"Reducing Child, Early, and Forced Marriage",2018,2022,Humanity and Inclusion and World Education,This activity contribute to the goal of improving reading outcomes for Nepali children with disabilities in grades 1 – 3 in the sixteen EGRP districts.,https://www.usaid.gov/nepal/fact-sheets/reading-all,-,X,,,X
USAID,Afghanistan,Livelihood  Advancement for Marginalized Population (LAMP),2018,2023,CARE USA,"This activity will create job opportunities and address the constraints on marginalized populations through high-value vegetable production for beneficiaries with limited access to land, livestock and poultry production, vocational training and jobs, and school to work transition support for new high school and university graduatess. ",https://www.usaid.gov/news-information/fact-sheets/livelihood-advancement-marginalized-populations-lamp, , ,X,X, 
USAID,Afghanistan,Strengthening Education in Afghanistan (SEA) II,2014,2023,The Asia Foundatoin,This activity provides a broad range of support to institutions and civil society organizations working in Afghanistan’s education sector.,"https://www.usaid.gov/news-information/fact-sheets/strengthening-education-afghanistan-ii-sea-ii#:~:text=SEA%20II%20aims%20to%20improve,higher%20education%20needs%20of%20Afghanistan.", , ,X, ,X
USAID,Djibouti,DEGRA,2019,2024,FHI 360,This activity will improve the reading skills of children at the primary level in targeted areas in three ways: Support the Ministère de l’Education Nationale et de la Formation Professionnelle (MENFOP) improve early grade reading instruction; Increase community support and engagement for reading; and by improving the policy environment for reading. ,https://www.usaid.gov/sites/default/files/documents/1860/Djibouti-Fact-Sheet_Education_June-2019.pdf,,,,,
USAID,Somalia,"Bar ama Baro (Teach or Learn, ""BAB"")",2019,2024,Creative Associates,"Bar ama Baro aims to increase access to quality education for a targeted number of out-of-school children and youth of ages approximately 8-15 in targeted regions of Somalia. Bar ama Baro will
increase student enrollment in accelerated education centers (AE), improve student safety, monitor improvements in literacy, numeracy and socio-emotional skills among students in these AE centers, and
improve the Federal Government of Somalia’s capacity to standardize and regulate the accelerated education space.",https://www.usaid.gov/sites/default/files/documents/1860/Fact_Sheet_-_Somalia_BAB_February_2020.pdf,,X,X,,X
