Agency,Country,Activity Name,Start Year,End Year,Implementer,Description,Link to Website,Pre-Primary,Primary,Secondary,Workforce Development,Education Systems Strengthening
USAID,Morocco,Reading for Success - National Reading Program (NPR),2017,2022,Creatives Associates,"This activity will support the Ministry of Education to develop, roll out, and eventually scale-up a full Arabic Language curriculum for grades 1-6. The activity will also focus on building the capacity of MOE staff and leadership and will offer training to primary teachers using face-to-face workshops and online and/blended learning.",https://www.creativeassociatesinternational.com/projects/morocco-reading-success-national-program-reading/,-,X,,,X
USAID,Nicaragua,Skills in Action,2020,2025,Creative Associates,"This activity aims to build resilience capacity, advance economic and civic participation, and develop skills for professional and personal growth for youth and improvement of their communities.",https://www.creativeassociatesinternational.com/projects/nicaragua-technical-vocational-education-and-training-strengthening-for-at-risk-youth/,-,,,X,X
USAID,Honduras,Creando mi Futuro Aqui,2021,2026,DAI,"This activity seeks to increase employment of at-risk youth in high out-migration areas in support of Mission-wide efforts to reduce irregular migration to the United States by strengthening at-risk youth’s resilience to crime and increasing their income generating opportunities. Working through partnerships with public and private sector stakeholders, this Activity will reach at least 500,000 at-risk youth to become productively engaged in the Honduran economy and society over a period of five years. Out of those 500,000 at-risk youth, 100,000 will 1) secure viable employment, or 2) return to full formal and alternative education and technical/vocational training, or 3) create innovative at-risk youth enterprises including social entrepreneurs. ",https://www.dai.com/our-work/projects/honduras-creando-mi-futuro,,,X,X,X
USAID,Indonesia,Mitra Kunci,2017,2022,"DAI Global, LLC","This activity works with six Project Implementers to improve access to skills, training, information, experience and relevant services for P&V youth. Its main tasks are to support the three Indonesian-led consortia to pilot their models for inclusive workforce development and to meet financial and administrative requirements for implementing USAID grants.",https://www.dai.com/our-work/projects/indonesia-mitra-kunci-initiative,-,,,X,X
USAID,Malawi,SEED Impact Evaluation (D4I),2018,2023,University of North Calorina (UNC),"The activity evaluate the Secondary Education Expansion and Development Activity that expanded 33 CDSS in urban education districts of Mzuzu, Lilongwe, Zomba and Blantyre and construction of new secondary schools country wide ",https://www.data4impactproject.org/,-,,X,,X
DOL/OCFT,Ghana,Adwuma Pa - Empowering Women and Girls in Supply Chains,2018,2022,CARE,"This activity works to reduce the risk of child and forced labor, and other exploitative labor practices by improving the economic participation and empowerment of women and girls within cocoa-producing communities in Ghana. Activities include providing women and adolescent girls Functional Literacy and Numeracy training; life skills training; and vocational training.",https://www.dol.gov/agencies/ilab/adwuma-pa,,,X,X,
DOL/OCFT,Mexico,Campos de Esperanza,2016,2023,World Vision,"This activity works to build the capacity of government, employers, workers’ organizations, and civil society actors to address child labor in migrant communities in Mexico.",https://www.dol.gov/agencies/ilab/campos-de-esperanza-fields-hope,,x,x,x,x
DOL/OCFT,Honduras,Futuros Brillantes,2014,2023,World Vision,"This activity works to reduce child labor and improve labor rights in Honduras, particularly in Valle, Choluteca, Intibucá, Atlántida, La Paz, and in the the San Pedro Sula (SPS) area. The second objective is to work with the Honduran Government, industry, and other stakeholders to build the STSS’ capacity to identify and use all available tools to help ensure remediation of labor law violations related to freedom of association, the rights to organize and bargain collectively, in the maquiladora sector.",https://www.dol.gov/agencies/ilab/futuros-brillantes-project-reduce-child-labor-and-improve-labor-rights-and-working-0,,X,X,,X
DOL/OCFT,Burma,My-PEC Project,2013,2023,ILO,"This activity supports improved access to and participation in education and vocational services to children engaged in child labor (CL) or at risk of CL for the purpose of CL prevention or withdrawal. As of 3/31/22, 3,546 children are benefiting from such support.",https://www.dol.gov/agencies/ilab/my-pec-myanmar-program-elimination-child-labor-0,,X,X,X,
DOL/OCFT,Argentina,Project to Promote Workplace-Based Training for Vulnerable Youth in Argentina (NOEMI),2016,2022,Desarollo y Autogestion (DyA),"The project helps bridge the skills gap in Argentina by increasing the number and quality of on-the-job training programs, such as internships and apprenticeships, and ensures these opportunities are accessible to the youth who need them the most. The project supports improvements in the legal and policy framework surrounding youth training, raises awareness about the benefits of work-based training, documenting and disseminating good apprenticeship practices in Argentina, and helps both public and private-sector youth training programs to increase their effectiveness.",https://www.dol.gov/agencies/ilab/project-promote-workplace-based-training-vulnerable-youth-argentina,,,x,x,
DOL/OCFT,Ethiopia,She Thrives - Reducing Child Labor in Ethiopia’s Agricultural Sector using a Gender-Focused Approach,2020,2025,CARE,"This activity seeks to build agency of vulnerable women and girls in the Ethiopian agricultural sector by enhancing technical and life skills, and employment services. Activities include providing evidence-based leadership and life skills curriculum to adolescents vulnerable to child labor; accelerated education programs to encourage meaningful transitions back into formal schooling, skills, or an entrepreneurship training program; and increased access to Technical and Vocational Education and Training (TVET) and other skills-based training programs.",https://www.dol.gov/agencies/ilab/she-thrives-reducing-child-labor-ethiopias-agricultural-sector-using-gender-focused,,X,X,X,
DOL/OCFT,Vietnam,ENHANCE Project,2014,2022,ILO,"This activity supports improved access to and participation in education and vocational services to children engaged in child labor (CL) or at risk of CL for the purpose of CL prevention or withdrawal. As of 3/31/21, 66 children are benefiting from such support.",https://www.dol.gov/agencies/ilab/technical-support-enhancing-national-capacity-prevent-and-reduce-child-labour-0,,x,x,X,
DOL/OCFT,Costa Rica,"Youth Pathways to Leadership, Learning, and Livelihoods in Costa Rica (YPCR)",2016,2022,YouthBuild International,"This activity works to to improve Costa Rica's country capacity to implement quality workplace-based training alternatives for vulnerable youth excluded from quality employment training opportunities and at high risk of becoming engaged in hazardous activities. The project successfully piloted its strategies to build the capacity of local government, civil society and private sector organizations to implement youth employment training models in the Limón Province which will be mainstreamed into the Ministry of Labor's National Employment System .",https://www.dol.gov/agencies/ilab/youth-pathways-leadership-learning-and-livelihoods-costa-rica,,,,X,
USAID,Malawi,GBAIA Global Book Alliance,2021,2023,Education Development Center (EDC),The activity aims to support the book chain actors in Malawi by  1) support the developemnt of the national book policy; 2) Training and Capacity building of local publishers to create children reading books; 3) Demand driven activities to stimulate culture of raeding; 4) Capacity building of MOE institutions in the national book development policy.,https://www.edc.org/global-book-alliance-action,- ,X,X,,X
USAID,Uganda,Integrated Child and Youth Development (ICYD) Activity,2020,2025,EDC,"This activity supports the initiatives of the Ministry of Education and Sports to improve early grade reading, promote a positive and supportive school climate, and supports the Ministry of Gender, Labor and Social Development's program to reduce the vulnerability of orphans and vulnerable children and their families.",https://www.edc.org/ICYD,-,X,X,X,X
USAID,Philippines,Opportunity 2.0,2020,2025,Education Development Center,"This activity aims to strengthen second-chance education programs for vulnerable out-of-school youth in the Philippines to provide skills and opportunities to improve their education, employment, and livelihood outcomes.",https://www.edc.org/opportunity-20,-,,X,X,X
USAID,Honduras,Honduras Reading Activity (HRA) - De Lectores a Lideres,2017,2023,EDU,"This activity supports the efforts of the Government of Honduras (GOH) in collaboration with other activities and stakeholders (donors, civil society, and private sector) by providing technical assistance to improve reading instruction and outcomes for Honduran students from first to sixth grade.",https://www.edc.org/usaid-de-lectores-l%C3%ADderes-usaid-honduras-reading-activity,,X,,,X
USAID,Honduras,Reading Improvement Activity,2017,2022,EDC,This activity will provide technical assistance to improve early grade reading skills for Honduran students from first to sixth grade in the target regions. The emphasis of this Activity is to build the capacity of Honduran partners to develop locally-grounded solutions to improve basic education reading outcomes.,https://www.edc.org/usaid-de-lectores-l%C3%ADderes-usaid-honduras-reading-activity,-,X,,,X
USAID,Zambia,Let's Read Zambia,2019,2023,EDC,"This activity’s goal is to improve reading outcomes for approximately 1.4 million children attending pre-primary (Kindergarten) through Grades 3 in Zambian public and community schools in the five target provinces of Eastern, Muchinga, Southern, Northwestern and Western.",https://www.edc.org/usaid-lets-read-zambia,X,X,,,X
USAID,Cambodia,All Children Learning,2018,2022,RTI International,"This activity will provide technical assistance to the MoEYS to scale up a national early grade learning program by supporting in-service teacher training, the development of teaching and learning materials, and coaching to build teacher capacity to improve the early grade learning skills of children with and without disabilities in primary schools. ",https://www.edu-links.org/about/education-programs/all-children-reading-cambodia,X,X,X,,X
USAID,Honduras,School-Based Violence Prevention Activity (SBVPA) - Asegurando la Educacion,2017,2022,"DAI Global, LLC","This activity will address school-based violence that impedes the delivery of education and its goals of access, retention and learning and use education and school processes to contribute to violence prevention in target communities. This activity will focus on education centers which may include 'Centros Basicos' (grades 4-9), 'Institutos' (grades 10-12).",https://www.edu-links.org/about/education-programs/school-based-violence-prevention-activity-sbvpa,-,X,X,,X
USAID,Jordan,Schools for a Knowledge Economy Project (SKEP),2015,2022,Multiple,"This activity improves learning environments through construction of 25 accessible, modern, new schools nationwide with a focus on communities hosting Syrian refugees.",https://www.edu-links.org/about/education-programs/schools-knowledge-economy-project-skep,X,X,X,,
USAID,Democratic Republic of the Congo,Catalyze/EduFinance,2021,2024,Palladium/Opportunity International,"This activity increases investment in the low-cost private education sector, strengthens the viability of schools to offer access to equitable education, and increases learning outcomes of disadvantaged children, especially girls.",https://www.edu-links.org/resources/catalyze-edufinance-mobilizing-private-capital-education,,,,,x
USAID,Guatemala,Safe Return to School activity,2021,2022,FUNSEPA,"This activity supports the safe return to schools - providing 1.5M masks, hygiene and disinfection kits for 17,000+ schools, provide technology to schools, supporting roll out of COVID-19 protocol app",https://www.edu-links.org/sites/default/files/media/file/Supporting%20a%20Safe%20Return%20to%20Learning.pdf,,X,X,,X
USAID,Malawi,Upper Primary Reading (UPRead) activity,2021,2026,Malawi Institute of Education (MIE),UPRead Activity will institute a comprehensive reading materials development system for upper primary to support improved learning outcomes in Standards 5 to 8,https://www.facebook.com/USAIDMalawi/posts/790956718967380,-,X,,,X
USDA,Bangladesh,McGovern-Dole International Food for Education and Child Nutrition,2020,2023,World Food Programme,"This activity reduces hunger and improves literacy and primary education through the provision of a daily school meal. Additional activities include teacher training, WASH, nutrition education and capacity building at the local, regional and national level to benefit primary school age children in 138 schools.",https://www.fas.usda.gov/programs/mcgovern-dole-food-education-program,,X,,,
USDA,Benin,McGovern-Dole International Food for Education and Child Nutrition,2017,2022,Catholic Relief Services,"This activity reduces hunger and improves literacy and primary education through the provision of a daily school meal. Additional activities include teacher training, WASH, nutrition education and capacity building at the local, regional and national level to benefit primary school age children in 146 schools.",https://www.fas.usda.gov/programs/mcgovern-dole-food-education-program,X,X,,,
USDA,Benin,McGovern-Dole International Food for Education and Child Nutrition,2021,2026,Catholic Relief Services,"This activity reduces hunger and improves literacy and primary education through the provision of a daily school meal. Additional activities include teacher training, WASH, nutrition education and capacity building at the local, regional and national level. The project aims to benefit an estimated 111,163 people over the life of the project.",https://www.fas.usda.gov/programs/mcgovern-dole-food-education-program,,x,,,
USDA,Burkina Faso,McGovern-Dole International Food for Education and Child Nutrition,2018,2022,Catholic Relief Services,"This activity reduces hunger and improves literacy and primary education through the provision of a daily school meal. Additional activities include teacher training, WASH, nutrition education and capacity building at the local, regional and national level to benefit primary school age children in 852 schools.",https://www.fas.usda.gov/programs/mcgovern-dole-food-education-program,X,X,,,
USDA,Burkina Faso,McGovern-Dole International Food for Education and Child Nutrition,2021,2026,Catholic Relief Services,"This activity reduces hunger and improves literacy and primary education through the provision of a daily school meal. Additional activities include teacher training, WASH, nutrition education and capacity building at the local, regional and national level. The project aims to benefit an estimated 112,509 people over the life of the project.",https://www.fas.usda.gov/programs/mcgovern-dole-food-education-program,X,x,,,
USDA,Cameroon,McGovern-Dole International Food for Education and Child Nutrition,2018,2023,Nascent Solutions,"This activity reduces hunger and improves literacy and primary education through the provision of a daily school meal. Additional activities include teacher training, WASH, nutrition education and capacity building at the local, regional and national level to benefit pre-primary and primary school age children in 240 schools.",https://www.fas.usda.gov/programs/mcgovern-dole-food-education-program,X,X,,,
USDA,Cote d'Ivoire,McGovern-Dole International Food for Education and Child Nutrition,2020,2025,Catholic Relief Services,"This activity reduces hunger and improves literacy and primary education through the provision of a daily school meal. Additional activities include teacher training, WASH, nutrition education and capacity building at the local, regional and national level to benefit primary school age children in 613 schools.",https://www.fas.usda.gov/programs/mcgovern-dole-food-education-program,,x,x,,
USDA,Ethiopia,McGovern-Dole International Food for Education and Child Nutrition,2019,2023,WFP,"This activity reduces hunger and improves literacy and primary education through the provision of a daily school meal. Additional activities include teacher training, WASH, nutrition education and capacity building at the local, regional and national level to benefit pre-primary and primary school-age children in 817 schools.",https://www.fas.usda.gov/programs/mcgovern-dole-food-education-program,x,x,,,
USDA,Guatemala,McGovern-Dole International Food for Education and Child Nutrition,2020,2025,Catholic Relief Services,"This activity reduces hunger and improves literacy and primary education through the provision of a daily school meal. Additional activities include teacher training, WASH, nutrition education and capacity building at the local, regional and national level to benefit primary school age children in 337 schools.",https://www.fas.usda.gov/programs/mcgovern-dole-food-education-program,X,X,,,
USDA,Guatemala,McGovern-Dole International Food for Education and Child Nutrition,2018,2023,Save the Children,"This activity reduces hunger and improves literacy and primary education through the provision of a daily school meal. Additional activities include teacher training, WASH, nutrition education and capacity building at the local, regional and national level to benefit primary school age children in 283 schools.",https://www.fas.usda.gov/programs/mcgovern-dole-food-education-program,X,X,,,
USDA,Guatemala,McGovern-Dole International Food for Education and Child Nutrition,2016,2022,Project Concern International,"This activity reduces hunger and improves literacy and primary education through the provision of a daily school meal. Additional activities include teacher training, WASH, nutrition education and capacity building at the local, regional and national level to benefit primary school age children.",https://www.fas.usda.gov/programs/mcgovern-dole-food-education-program,X,X,,,
USDA,Guatemala,McGovern-Dole International Food for Education and Child Nutrition,2021,2026,Global Communities,"This activity reduces hunger and improves literacy and primary education through the provision of a daily school meal. Additional activities include teacher training, WASH, nutrition education and capacity building at the local, regional and national level. The project aims to benefit an estimated 94,522 people over the life of the project.",https://www.fas.usda.gov/programs/mcgovern-dole-food-education-program,X,x,,,
USDA,Guinea Bissau,McGovern-Dole International Food for Education and Child Nutrition,2019,2023,Catholic Relief Services,"This activity reduces hunger and improves literacy and primary education through the provision of a daily school meal. Additional activities include teacher training, nutrition education and capacity building at the local, regional and national level to benefit primary school age children in 600 schools.",https://www.fas.usda.gov/programs/mcgovern-dole-food-education-program,x,x,,,
USDA,Haiti,McGovern-Dole International Food for Education and Child Nutrition,2019,2023,WFP,"This activity reduces hunger and improves literacy and primary education through the provision of a daily school meal. Additional activities include teacher training, WASH, nutrition education and capacity building at the local, regional and national level to benefit pre-primary and primary school-age children in 400 schools.",https://www.fas.usda.gov/programs/mcgovern-dole-food-education-program,x,x,,,
USDA,Honduras,McGovern-Dole International Food for Education and Child Nutrition,2020,2025,Catholic Relief Services,"This activity reduces hunger and improves literacy and primary education through the provision of a daily school meal. Additional activities include teacher training, WASH, nutrition education and capacity building at the local, regional and national level to benefit primary school age children in 1,040 schools.",https://www.fas.usda.gov/programs/mcgovern-dole-food-education-program,x,X,X,,
USDA,Kenya,McGovern-Dole International Food for Education and Child Nutrition,2016,2022,WFP,"This activity reduces hunger and improves literacy and primary education through the provision of a daily school meal. Additional activities include teacher training, WASH, nutrition education and capacity building at the local, regional and national level to benefit pre-primary and primary school-age children.",https://www.fas.usda.gov/programs/mcgovern-dole-food-education-program,x,x,,,
USDA,Kyrgyz Republic,McGovern-Dole International Food for Education and Child Nutrition,2021,2026,Mercy Corps,"This activity reduces hunger and improves literacy and primary education through the provision of a daily school meal. Additional activities include teacher training, WASH, nutrition education and capacity building at the local, regional and national level. The project aims to benefit an estimated 107,000 people over the life of the project.",https://www.fas.usda.gov/programs/mcgovern-dole-food-education-program,,x,,,
USDA,Laos,McGovern-Dole International Food for Education and Child Nutrition,2016,2022,Catholic Relief Services,"This activity reduces hunger and improves literacy and primary education through the provision of a daily school meal. Additional activities include teacher training, WASH, nutrition education and capacity building at the local, regional and national level to benefit pre-primary and primary school-age children in 348 schools.",https://www.fas.usda.gov/programs/mcgovern-dole-food-education-program,x,x,,,
USDA,Laos,McGovern-Dole International Food for Education and Child Nutrition,2017,2022,World Food Programme,"This activity reduces hunger and improves literacy and primary education through the provision of a daily school meal. Additional activities include teacher training, WASH, nutrition education and capacity building at the local, regional and national level to benefit pre-primary and primary school-age children in 1,440 schools.",https://www.fas.usda.gov/programs/mcgovern-dole-food-education-program,x,x,,,
USDA,Laos,McGovern-Dole International Food for Education and Child Nutrition,2019,2024,World Food Programme,"This activity reduces hunger and improves literacy and primary education through the provision of a daily school meal. Additional activities include teacher training, WASH, nutrition education and capacity building at the local, regional and national level to benefit pre-primary and primary school-age children in 736 schools.",https://www.fas.usda.gov/programs/mcgovern-dole-food-education-program,x,x,,,
USDA,Laos,McGovern-Dole International Food for Education and Child Nutrition,2021,2026,Catholic Relief Services,"This activity reduces hunger and improves literacy and primary education through the provision of a daily school meal. Additional activities include teacher training, WASH, nutrition education and capacity building at the local, regional and national level. The project aims to benefit an estimated 122,063 people over the life of the project.",https://www.fas.usda.gov/programs/mcgovern-dole-food-education-program,X,x,,,
USDA,Liberia,McGovern-Dole International Food for Education and Child Nutrition,2017,2022,Save the Children,"This activity reduces hunger and improves literacy and primary education through the provision of a daily school meal. Additional activities include teacher training, WASH, nutrition education and capacity building at the local, regional and national level to benefit pre-primary and primary school-age children in 231 schools.",https://www.fas.usda.gov/programs/mcgovern-dole-food-education-program,X,X,,,
USDA,Liberia,McGovern-Dole International Food for Education and Child Nutrition,2021,2026,Save the Children,"This activity reduces hunger and improves literacy and primary education through the provision of a daily school meal. Additional activities include teacher training, WASH, nutrition education and capacity building at the local, regional and national level. The project aims to benefit an estimated 176,958 people over the life of the project.",https://www.fas.usda.gov/programs/mcgovern-dole-food-education-program,x,x,,,
USDA,Madagascar,McGovern-Dole International Food for Education and Child Nutrition,2021,2026,Global Communities,"This activity reduces hunger and improves literacy and primary education through the provision of a daily school meal. Additional activities include teacher training, WASH, nutrition education and capacity building at the local, regional and national level. The project aims to benefit an estimated 64,177 people over the life of the project.",https://www.fas.usda.gov/programs/mcgovern-dole-food-education-program,X,x,,,
USDA,Malawi,McGovern-Dole International Food for Education and Child Nutrition,2019,2023,Nascent Solutions,"This activity reduces hunger and improves literacy and primary education through the provision of a daily school meal. Additional activities include teacher training, WASH, nutrition education and capacity building at the local, regional and national level to benefit pre-primary and primary school-age children in 187 schools.",https://www.fas.usda.gov/programs/mcgovern-dole-food-education-program,x,x,,,
