Agency,Country,Activity Name,Start Year,End Year,Implementer,Description,Link to Website,Pre-Primary,Primary,Secondary,Workforce Development,Education Systems Strengthening
USAID,Georgia,Basic Education Program,2020,2023,RTI,"The activity supports the implementation of sustainable, inclusive, and student-centered education reforms in line with the priorities of the Government of Georgia; supports all primary school students, emphasizing interactive learning methods to help students develop skills in reading, mathematics, critical thinking, and problem-solving to establish a foundation for lifelong success.",-,,X,,,X
USAID,Burma,Community Strengthening Project (CSP),2018,2023,DAI,"This activity will work with communities affected by conflict to increase community participation and local ownership of essential services, and community development initiatives, peace, and reconciliation efforts. It will train community leaders in dispute resolution and conflict management, support deeper engagement of community leaders with local government, and support joint projects and skills training for people of diverse backgrounds.",-,,,,,
USAID,Haiti,Continuity of Learning,2021,2026,CRS ,This activity is for learners ages six through twelve to benefit from a resilient education system that delivers uninterrupted access to a safe and quality education.,-,X,,,,
USAID,Eastern and Southern Carribbean,Education Research Initiative,2021,2024,UWI,The activity works to build the basic education research base and respository for the Eastern and Southern Caribbean.,-,,X,X,,
USAID,Guatemala,Gen Now Youth Impact Leaders (Central American Service Corps),2022,2023,Glasswing International,"This activity will lay the groundwork for a national service corps in Honduras and Guatemala through stakeholder engagement, a robust learning agenda, and development of a business model with Standard Operating Procedures; designed to support CAYEP/CASC - co-creation",-,,,,X,
USAID,Honduras,Gen Now Youth Impact Leaders (Central American Service Corps),2022,2023,Glasswing International,"This activity will lay the groundwork for a national service corps in Honduras and Guatemala through stakeholder engagement, a robust learning agenda, and development of a business model with Standard Operating Procedures; designed to support CAYEP/CASC - co-creation",-,,,,X,
USAID,El Salvador,Global Development Alliance Oportunidades activity,2021,2026,"Fundación ""Gloria de Kriete"" (FGK)","This activity will help restore access to education and deter illegal migration, especially among youth, during and after the COVID-19 outbreak. This activity will increase opportunities for social inclusion, vocationally focused learning, and violence prevention for vulnerable youth of both sexes who have limited resources but demonstrate academic achievement. This activity will provide: complimentary education for high school students from public schools (Phase 1), scholarships for higher education studies (Phase 2), and once students graduate from phase 2, they have access to internships and/or fisrt job (Phase 3). Beneficiaries are vulnerable youth, living in high risk communities, who have limited resources.",-,,,X,X,
USAID,El Salvador,High Impact Soyapango activity,2021,2025,"Fundación ""Rafael Meza Ayau"" (FRMA)","The activity’s main objective is to improve the quality of life of families in Soyapango, by increasing the opportunities related to the economic and social development of the municipality. This will be achieved through collaborative work between civil society organizations, the private sector, government organizations, and the population of the municipality.",-,,X,X,X,X
USAID,Dominican Republic,Higher Education Partnership ,2019,2024,ISA Univeristy,"This activity aims to develop innovative and sustainable partnerships in DR-HEIs to strengthen institutional programs and services targeting YHRE, ensuring access and completion of tertiary education to increase their access to decent work and social wellbeing.",-,,,X,,X
USAID,Rwanda,Homes and Communities,2021,2026,World Vision,"This activity provides all Rwandan children with literacy-supportive, stimulating, and safe home and community environments for improved literacy outcomes by the end of P3 by improving home literacy environments, increasing community engagement in promoting children’s literacy, and improving literacy learning opportunities for children with disabilities.",-,x,x,,,
USAID,Afghanistan,Keep Schools Open Initiative,2022,2023,UNICEF,This activity sustains access to education for children in Afghanistan,-,,x,x,,
USAID,Senegal,Ndiyam E Ekkolaaji (Water in Schools),2020,2023,Eau Vive,This activity aims to bring water to schools in Senegal's arid northeast region of Matam where 30% of schools do not have running water. The activity will improve access to drinking water for pupils and teachers within the school by rehabilitating/creating adequate water points and promoting good hygiene practices among students and teachers. ,-,,,,,
USAID,Guatemala,Safe Return to School Plus,2021,2023,UNICEF,"This activity provides support for the MOE to adapt to the COVID-19 environment, provide technical assistance on emergency response and disaster preparedness, recover from the impact of Eta and Iota storms, and mitigate the impact of climate change by improving water, sanitation, hygiene (WASH) in schools, improving access to electricity, and strengthening the education system.",-,,X,X,,X
USAID,Jordan,School Transformation Project,2022,2028," Ministry of Education, Ministry of Public Works and Housing, Baha Consultant Engineering, host country Contractors","USAID’s School Transformation Project will redesign and transform thirty Ministry of Education schools in the most densely populated areas of Jordan. The Project seeks to transform existing schools into innovative, inclusive schools while increasing capacity and significantly improving learning environments for all students.",-,,x,x,,
USAID,South Africa,South Africa Early Years Index (SAEYI) - Thrive By Five,2021,2022,Innovation Edge,"This activty has developed an Index that provides population-level data on how well preschool children in South Africa (aged 50-59 months) are doing in three key developmental domains which are associated with longer-term outcomes: Early Learning, Physical Growth, and Social-Emotional Functioning.",-,X,,,,
USAID,Egypt,Teacher Excellence Initiative,2022,2027,Education Development Center,This activity improves the quality and relevance of teacher preparation by establishing undergraduate and graduate degree programs for primary-grade teachers at Egyptian public universities and strengthening government systems and coordination for teacher preparation. ,-,,,,,x
USAID,Liberia ,The Youth Activity,2021,2025,EDC,"This activity increases livelihood prospects and economic self reliace of 21,000 targeted Liberia youths aged 15-29. It will strengthen their foundational skills and provide employement training.",-,,,,X,X
USAID,Liberia ,Transforming Education System for Teachers and Students,2021,2026,RTI,This activity parters with the MOE and National Commission on Higher Education to improve the quality of early childhood eduaiton and primary teachers' instructional delivery,-,X,X,,,X
USAID,Egypt,Workforce Egypt ,2021,2026,MTC International Development Holding Company,"USAID is accelerating the Ministry’s technical secondary education reform by creating seven new market-driven specializations, establishing ten new technical applied technology schools, and strengthening national systems for quality assurance and accreditation. ",-,,,x,x,x
USAID,Haiti,Youth Engagement and Empowerment Activity (YEEA),2021,2022,PADF and OAS,This activity is focused on youth workforce developmet for at-risk youth in Haiti to prevent violence amongst young people.,-,,,,X,X
USAID,Malawi,Reading for All Malawi (REFAM),2019,2022,Juarez & Associates,"This is an inclusive education reading program that provides the Ministry of Education with a scalable intervention model that allows for the screening, identification, placement, instruction, and testing of learners with disabilities in order to help them better acquire reading skills.",http://juarezassociates.com/reading-for-all-malawi/,-,X,X,,X
USAID,Malawi,Reading for All Malawi (REFAM),2019,2023,Juarez & Associates,This activity was established to address significant gaps emerging from the general adoption of the National Reading Program as a strategy to improve and promote reading and writing skills in English and Chichewa among Standard 1 to 4 learners with disabilities.,http://juarezassociates.com/reading-for-all-malawi/,-,X,,,X
DOL/OCFT,Colombia,Vamos Tejiendo/Equal Project,2019,2023,PACT,"This activity works to increase job training and economic opportunities for more than 2,000 women and girls who are vulnerable to child labor, forced labor, or violations of labor rights, within the panela (sugarcane) and cut flowers sectors. Children at high risk of Child Labor get access to education or vocational services. Direct participants get training in soft and technical skills based on demands in target value chains, and a later stage job placement.",http://www.dol.gov/agencies/ilab/equal-access-quality-jobs-women-and-girls-agriculture-equal-colombia,,,,X,
USAID,Malawi,"Printing, Binding, and Distribution of Chichewa and English Learners’ Books (LBs) and Teachers’ Guides (TGs) Activity",2022,2023,Kris Offset Printers,Print education materials and textbooks in support of NextGen and other USAID/Malawi activities.,http://www.krisoffset.com/,-,X,,,
USAID,Jordan,Enhancing School Management Project (ESMP),2019,2023,Kaizen,"This activity improves existing management systems and procedures for the planning, construction, and utilization of public schools in Jordan.",http://www.thekaizencompany.com/project/enhancing-school-management-and-planning/,X,X,X,,X
USAID,Nigeria ,Strengthening Education in Northeast Nigeria States (SENSE),2019,2022,Ameircan University of Nigeria ,"This activity aims to improve learning outcomes in literacy and access to quality education for 200,000 primary learners by strengthening the capacity of educational management, improving teacher classroom practice, and enhancing safe learning spaces with quality materials.",https://atikucenter.org/projects/usaid-sense,-,X,,,X
USAID,Tanzania,Waache Wasome (Let Them Learn),2016,2022,World Education Inc./Bantwana Initiative,"This activity’s efforts are rooted in the principle of empowering girls to create and achieve goals for their future while addressing the social/gender norms, economic barriers, and violence that constrain their ability to remain and excel in school. ",https://bantwana.org/project/waache-wasome/,-,,X,X,X
USAID,Jordan,Construction Management Services for JSEP and SKEP,2018,2022,Trigon Associates LLC,"This activity provides overall construction management services for the construction of up to 25 new schools, approximately 70 school expansion and kindergarten (KG) sites, and 50 sports and activity facilities.",https://bitarconsultants.com/projects/educational/jordan-school-expansion-project-jsep,-,,,,
USAID,Pakistan,Sindh Community Mobilization Program,2013,2022,Blumont Engineering Solutions Inc,This activity supports community sensitization for increased enrollment and retention. It also assists the host government to engage private sector Education Management Organizations to improve education service delivery in public schools.,https://blumont.org/program/sindh-community-mobilization-program/,X,X,X, ,X
USAID,Nepal,Nepal Reconstruction Engineering Services (NRES - A&E),2017,2022,CDM International Inc.,"This activity strengthens the Government of Nepal’s ability to manage reconstruction and independently deliver services, utilize disaster resilient designs, adopt improved building codes and internationally accepted best practices in construction management, and inclusively engage with communities for sustainability.",https://cdmsmith.com/en/Client-Solutions/Projects/USAID-Nepal-Reconstruction-Engineering-Services,X,X,X,,X
USAID,Malawi,NextGen -Next Generation Early Grade Reading Activity,2022,2027,Chemonics,NextGen  activity intends to provide technical support to the Ministry of  Education's National Reading Program to improve students reading  outcomes in grades 1 and 2.  The main goal is to have a minimum of 30% of Malawian Second Grade Students demonstrate: minimum reading proficiency in Chichewa by the end of second grade; measurable improvements in English oral expression by the end of second grade; and measurable improvements in essential sub-skills in English reading.,https://chemonics.com/projects/sustaining-the-legacy-of-holistic-education-in-malawi/,X,X,,,X
USAID,Paraguay,"Higher Education Center for Ethics, Equity and Transparency (HECEET)",2019,2022,"Rutgers, The State University of New Jersey","This activity will focus on capacity building to establish a Higher Education Center for Ethics, Equity and Transparency at the National University of Asuncion. The goal is to transform UNA into an anchor for transparency, civility, equity and transparency in Paraguay.",https://clc.camden.rutgers.edu/heceet-paraguay/,,,,,X
USAID,Mozambique,Community Engagement for Bilingual Education (Nampula),2020,2023,Ajuda de Desenvolvimento do Povo para Povo (ADPP) Mocambique,"This activity aims to strengthen civil society engagement in early grade reading and improve the quality of reading instruction for primary school-aged children to increase
the long-term sustainability of EGR activities.",https://concoursn.com/usaid-mozambique-seeking-applications-for-community-engagement-in-bilingual-education-program/,-,X,,,
USAID,Zambia,Education Data,2018,2022,DevTech,"This activity’s purpose is to provide distinct assessment, data management, and research and evaluation services to monitor and track the progress of USAID’s Let’s Read Zambia.",https://devtechsys.com/projects/Education-Data-Activity/,-,X,,,X
USAID,Eastern and Southern Carribbean,Saint Lucia Youth ConnectEd,2021,2023,World Education,"The activity focuses on improving teaching and learning through youth engagement, digital literacy  and IT integration in Saint Lucia. ",https://edtech.worlded.org/project/project-name-st-lucia-connected/,,,X,X,X
USAID,Morocco,Higher Education Partnership-Morocco,2019,2024,Arizona State University (ASU),This activity supports the Ministry of Education in the creation of a new and comprehensive undergraduate degree in teaching within Moroccan universities. The program focuses on preparing prospective teachers to teach at primary school levels.,https://education.asu.edu/projects-and-impact/higher-education-partnership-morocco,-,X,,,X
USAID,Somalia,Adolescent Girls' Education in Somalia (AGES) project,2018,2031,Care International,"The AGES project will work with communities, private providers, education ministries and religious leaders to improve literacy, numeracy and key life skills (financial literacy and knowledge of sexual and reproductive health) for up to 42,000 of the most marginalised girls in Somalia. The project will target the hardest to reach, out-of-school girls. It will focus on girls engaged in child labour, married and divorced girls, internally displaced persons, girls from minority clans and excluded groups, and pastoralists. Many of these girls have never attended school. The project will use a combination of formal and alternative education pathways to provide flexible learning options for girls who face multiple barriers to effective learning. It will work with girls, families, communities, schools and governments to promote lasting change in education.","https://girlseducationchallenge.org/projects/project/adolescent-girls-education-in-somalia-ages/#:~:text=The%20AGES%20project%20will%20work,most%20marginalised%20girls%20in%20Somalia.",,X,X,,X
USAID,Sri Lanka,YouLead,2017,2024,International Executive Service Corps (IESC),"This activity increases opportunities for employment and entrepreneurship for youth by developing workforce-relevant skills. It works with a wide array of public and private partners to strengthen youth skills development, improve the quality of technical and vocational education and training (TVET), and increase prospects for gainful self-employment. ",https://iesc.org/program/youlead/,-,,,X,X
USAID,South Africa,High Gear,2020,2024,International Youth Foundation,"This activity seeks to create a demand-driven TVET system aligned with industry and with quality course material delivery, that generates learning and employment outcomes for young women and men.",https://iyfglobal.org/initiatives/high-gear,-,,,X,X
USAID,Laos,Learn to Read,2018,2023,Save the Children,"This activity aims to improve reading skills for children from pre-primary to second grade, with a focus on non-Lao-speaking children and children with disabilities. The activity will support the development of evidence-based, supplemental reading materials and guidance, training teachers to effectively use the materials, and engaging communities to support reading outside of the classroom. ",https://laos.savethechildren.net/news/us-launches-new-program-improve-basic-education-laos,X,X,,,X
USAID,Uganda,"Integrated Community, Agriculture and Nutrition (ICAN) Activity",2018,2023,Abt Associates,"This activity aims to increase economic opportunities for 116,000 poor households by improving agriculture and non-agriculture-based livelihoods, and by strengthening their connections to markets and financial services in 8 districts.",https://makingcents.com/project/integrated-community-agriculture-and-nutrition-activity-ican/,-,X,,X,X
USAID,Malawi,STEP - Strengthening Teacher Education & Practice,2022,2027,Florida State University (FSU),"Strengthening Teacher Education Practice (STEP) was awarded on January 20, 2022 and is a five-year activity.The objective of the Strengthening Teacher Education and Practice (STEP) Activity is to strengthen the higher education systems to train teachers in early grade instruction and provide pathways of continuous professional development (CPD) for teachers to excel in their discipline and at the primary school level. ",https://news.fsu.edu/news/education-society/2022/02/09/usaid-florida-state-university-partnership-to-improve-teacher-training-colleges-in-malawi/,-,X,,X,X
USAID,Senegal,Our Children Read (Nos Enfants Lisent),2018,2022,Association Femmes Plus,This activity aims to improve community and parent engagement in early grade reading in the communities of the Fatick region. ,https://ongfemmesplus.com/portfolio/programme-usaid-nos-enfants-lisent/,-,X,,,X
USAID,Rwanda,Schools and Systems,2021,2026,FHI360,"This activity strengthens Rwanda’s education systems from national to local levels for improved literacy outcomes for all children by the end of P3 by improving emergent language and literacy, early grade reading classroom instruction, school environments and strengthening education systems management.  ",https://pages.usaid.gov/rwanda/education-office,X,x,,,x
USAID,Zambia,Together for Early Childhood Evidence,2020,2022,NORC (PRIME); University of Nebraska Medical Center (sub-contractor),"This activity convenes government officials, researchers and other stakeholders interested in pre-primary data and measurement in Africa. The Consortium facilitates cross-country learning on how pre-primary systems can better use data to improve young children’s early learning experiences.",https://pdf.usaid.gov/pdf_docs/PA00XF3V.pdf,X,,,,
USAID,El Salvador,Scholarships for Educational Opportunities Program,2021,2025,International Organization for Migration,"The activity aims to mitigate irregular migration from El Salvador by increasing equitable access to formal educational opportunities for potential migrants and returnees, by providing scholarships to 6450 beneficiaries. The scholarships programs offered are: a) two-year technical education for students to further develop their technical skills, b) short six-month vocational courses for youth to develop specific technical skills that will allow them to find a job in the short term, and c) accelerated education for out-of school youth participants to be re-incorporated into the educational system and receive their upper secondary education diploma.",https://pdf.usaid.gov/pdf_docs/PA00ZD5K.pdf,,,X,X,
USAID,Haiti,"Strong Beginnings: Leveraging the home, school, and church to develop the whol child",2020,2024,"University of Notre Dame (sub-contractors: CRS, CEEC, UniQ, Blue Butterfly)",This activity will improve reading and writing outcomes in both Creole and French. Existing teacher training and coaching efforts will be continued. Lessons will be embedded in a social-emotional learning approach to improve school culture. A learning laboratory will be created as a platform to employ a rapid-feedback model to build systematic learning into the early stages of pre-primary education. ,https://pulte.nd.edu/projects/strong-beginnings-developing-the-whole-child-in-haiti/,X,X,,,X
USAID,Paraguay,Higher Education Partnership/ Rule of Law and Culture of Integrity (ROLCI) Program,2019,2024,University of Notre Dame,"This activity seeks to strengthen the Rule of Law and the culture of lawfulness in Paraguay through higher education institutions. The ROLCI program will support curriculum development, improve quality of education and promote outreach activities at law schools and justice-related institutions (judicial training centers), so that HEI could support advancing Rule of Law reforms.","https://pulte.nd.edu/projects/usaid-paraguay-rule-of-law-and-culture-of-integrity/#:~:text=The%20USAID%20Paraguay%20Rule%20of,of%20anti%2Dcorruption%20in%20Paraguay.",,,,,X
USAID,Philippines,All Children Reading-Philippines (ACR),2018,2022,RTI International,"This activity focuses on EGR instruction and assessment in support of mother-tongue based multilingual education (MTB-MLE), and the use of educational technologies to support improved instruction in early grade reading, especially during school closures.",https://shared.rti.org/content/all-children-reading-philippines-project-background-brief,,,,,
USAID,Jordan,Early Grade Reading and Mathematics Initiative (RAMP),2015,2023,RTI International,"This activity is a comprehensive national reading and math project that focuses on teacher quality, learning materials, and community engagement.",https://shared.rti.org/featured-project-collections/jordanramp,-,X,,,X
USAID,Philippines,Gabay (Guide): Strengthening Inclusive Education for Blind/Deaf Children,2019,2024,"Resources for the Blind, Inc. (RBI)","This activity aims to improve screening, enrollment, and reading performance of the deaf, and increase local government attention to children from kindergarten through Grade 3 who are blind, deaf, or deaf-blind.",https://sts-international.org/portfolio/gabay-guide-strengthening-inclusive-education-for-blind-deaf-children/,X,X,,,X
USAID,Malawi,National Reading Program Implementation and Expansion (NRPIE),2019,2022,Florida State University (FSU),Technical assistance to MoEST to develop standard 1-4 benchmarks and revise Standards 5-8 curricullum,https://sts-international.org/sts-blog/sts-and-florida-state-university-partner-to-improve-teacher-training-colleges-in-malawi/,-,X,X,,X
USAID,Kazakhstan,Safe Migration in Central Asia,2019,2024,Winrock International,"This activity aims at strengthening the mutual accountability and effectiveness of the government, civil society, and the private sector to prevent trafficking in persons, protect survivors, and promote safe migration in Tajikistan and other Central Asian countries, including Kazakhstan, Kyrgyzstan, Turkmenistan and Uzbekistan.",https://winrock.org/document/safe-migration-in-central-asia-2/,-,,,,X
USAID,Tajikistan,Safe Migration in Central Asia,2019,2024,Winrock International,"This activity aims at strengthening the mutual accountability and effectiveness of the government, civil society, and the private sector to prevent trafficking in persons, protect survivors, and promote safe migration in Tajikistan and other Central Asian countries, including Kazakhstan, Kyrgyzstan, Turkmenistan and Uzbekistan.",https://winrock.org/document/safe-migration-in-central-asia-2/,-,,,,X
USAID,Malawi,YESA Activity (Assess the Learners),2018,2022,Abt Associates,"The activity supports the Ministry of Education to deliver national reading assessments (at national, school and community level) and to provide remediation in Chichewa and English to Stdandards 1-4 learners in support of the National Reading Program (NRP).",https://www.abtassociates.com/projects/improving-malawis-national-reading-program,-,X,,,
USAID,Tajikistan ,"Thrive Tajikistan Global Development Alliance (GDA)
",2018,2023,Aga Khan Foundation,"This activity works in 16 districts of Tajikistan along the Afghan border, advancing the partnership by enhancing integrated socio-economic development for people in GBAO and Khalton. It aims to ensure resources and social services are effectively deployed and able to be accessed and used, improve the performance of targeted smallholder farmers, and increase access and use by smallholder farmers to agricultural technical assistance and productive assets. ",https://www.akfusa.org/our-work/escomiad-integrated-development-tajikistan/,-,,X,X,X
USAID,Ethiopia,Reading for Ethiopia's Achievement Developed (READ) II activity,2018,2023,Creative Associates International,This activity’s objective is to contribute to the goal of improving reading proficiency by preparing a range of vulnerable students for learning and supporting a structured gender approach to increase boys’ and girls’ grade retention and grade progression at key grades in key regions or zones. ,https://www.creativeassociatesinternational.com/projects/ethiopia-read-ii/,-,X,,,X
